{
  "schema_version": 1,
  "id": "INSTALL-JOURNEY-7",
  "title": "Ordinary uninstall preserves durable state",
  "journey": "Ordinary removal removes application/package integration and preserves durable state. Explicit destructive purge is outside scope.",
  "platform": {
    "family": "linux_generic",
    "qualified_versions": [
      "pending exact qualified version (P018/P020)"
    ],
    "desktop_session": "required for graphical desktop journeys; otherwise not applicable",
    "package_manager": "pending native family qualification",
    "native_gui_package_handler": "pending qualified desktop handler",
    "applicable_families": [
      "windows",
      "debian",
      "ubuntu",
      "fedora",
      "rpm_family",
      "linux_generic"
    ]
  },
  "architecture": "x86_64",
  "execution_class": "NATIVE_CLEAN_MACHINE",
  "preconditions": [
    "Disposable dedicated acceptance identity and scenario-owned state.",
    "No prior Synveil installation, package registration, installer-owned integration or stale acceptance state unless a declared upgrade/recovery source is required.",
    "A brand-new OS and removal of unrelated user files are not required.",
    "Seed dedicated scenario-owned application config, credential presence/identity, client sync state, non-empty library and server config/database/object records where applicable; capture logical snapshots before the lifecycle operation."
  ],
  "required_capabilities": [],
  "artifact_requirements": {
    "required": true,
    "artifact_type": "installed package or installer identity",
    "identity_fields": [
      "product_version",
      "source_commit",
      "artifact_type",
      "filename",
      "sha256",
      "platform",
      "architecture",
      "release_channel",
      "trust_status"
    ]
  },
  "steps": [
    {
      "id": "STEP-01",
      "action": "uninstall",
      "description": "Perform ordinary, data-preserving uninstall."
    }
  ],
  "assertions": [
    {
      "id": "ASSERT-01",
      "type": "package_removed",
      "description": "Application payload and installer-owned integration are absent after ordinary uninstall."
    }
  ],
  "preservation_assertions": [
    {
      "id": "PRESERVE-01",
      "resource": "APPLICATION_CONFIG",
      "snapshot": "configuration_value_fingerprint"
    },
    {
      "id": "PRESERVE-02",
      "resource": "CREDENTIAL_STATE",
      "snapshot": "credential_presence_identity_usable"
    },
    {
      "id": "PRESERVE-03",
      "resource": "CLIENT_SYNC_STATE",
      "snapshot": "content_digest"
    },
    {
      "id": "PRESERVE-04",
      "resource": "USER_LIBRARY_CONTENT",
      "snapshot": "library_tree_digest"
    },
    {
      "id": "PRESERVE-05",
      "resource": "SERVER_CONFIG",
      "snapshot": "configuration_value_fingerprint"
    },
    {
      "id": "PRESERVE-06",
      "resource": "SERVER_DATABASE",
      "snapshot": "database_logical_fingerprint"
    },
    {
      "id": "PRESERVE-07",
      "resource": "SERVER_OBJECT_DATA",
      "snapshot": "record_count_logical_digest"
    }
  ],
  "forbidden_outcomes": [
    {
      "id": "FORBID_LIBRARY_DELETE",
      "description": "Installer lifecycle deletes user library content.",
      "on_observed": "FAIL"
    },
    {
      "id": "FORBID_SECRET_LEAK",
      "description": "Credential value is written to ordinary config or diagnostics.",
      "on_observed": "FAIL"
    },
    {
      "id": "FORBID_UNKNOWN_SCHEMA_RESET",
      "description": "Unknown or newer schema is reset or downgraded.",
      "on_observed": "FAIL"
    },
    {
      "id": "FORBID_SILENT_STARTUP",
      "description": "Persistent startup is enabled without explicit user consent.",
      "on_observed": "FAIL"
    },
    {
      "id": "FORBID_PUBLIC_CONTROL",
      "description": "Desktop control is exposed through a public TCP/HTTP listener.",
      "on_observed": "FAIL"
    },
    {
      "id": "FORBID_BLIND_REPLAY",
      "description": "An ambiguous mutation is blindly replayed without authoritative reconciliation.",
      "on_observed": "FAIL"
    },
    {
      "id": "FORBID_EARLY_SUCCESS",
      "description": "Installation is reported complete before payload, integration and launch verification.",
      "on_observed": "FAIL"
    }
  ],
  "evidence_requirements": {
    "minimum": "native-clean-machine",
    "satisfies": [
      "native-clean-machine",
      "release-acceptance"
    ]
  },
  "timeout_policy": {
    "seconds": 1800,
    "on_unknown_outcome": "reconcile_before_retry"
  },
  "cleanup_policy": {
    "ownership_scope": "scenario_created_only",
    "best_effort": true,
    "record_failure": true
  },
  "future_owner": {
    "implementation": [
      "P009",
      "P027"
    ],
    "acceptance": [
      "P020",
      "P028",
      "P045"
    ]
  },
  "availability": "IMPLEMENTATION_PENDING",
  "source_installation": null,
  "milestones": [],
  "interruption_points": [],
  "recovery_classifications": [],
  "capability_conditions": [
    {
      "families": [
        "debian",
        "ubuntu",
        "fedora",
        "rpm_family"
      ],
      "require_all": [
        "native_package_manager"
      ]
    }
  ]
}
