{
  "schema_version": 1,
  "id": "INSTALL-JOURNEY-1",
  "title": "Windows clean install and launch",
  "journey": "Per-user path avoids unexpected elevation; identity/location are deterministic; desktop/client payload and Qt runtime are complete; entrypoint launches; IPC is user-scoped; startup is consent-controlled.",
  "platform": {
    "family": "windows",
    "qualified_versions": [
      "pending exact qualified Windows version (P028)"
    ],
    "desktop_session": "required for graphical desktop journeys; otherwise not applicable",
    "package_manager": null,
    "native_gui_package_handler": null,
    "applicable_families": [
      "windows"
    ]
  },
  "architecture": "x86_64",
  "execution_class": "NATIVE_CLEAN_MACHINE",
  "preconditions": [
    "Disposable dedicated acceptance identity and scenario-owned state.",
    "No prior Synveil installation, package registration, installer-owned integration or stale acceptance state unless a declared upgrade/recovery source is required.",
    "A brand-new OS and removal of unrelated user files are not required."
  ],
  "required_capabilities": [
    "graphical_session",
    "release_download"
  ],
  "artifact_requirements": {
    "required": true,
    "artifact_type": "SynveilSetup.exe",
    "identity_fields": [
      "product_version",
      "source_commit",
      "artifact_type",
      "filename",
      "sha256",
      "platform",
      "architecture",
      "release_channel",
      "trust_status"
    ]
  },
  "steps": [
    {
      "id": "STEP-01",
      "action": "obtain_artifact",
      "description": "Obtain and identify the required artifact."
    },
    {
      "id": "STEP-02",
      "action": "open_installer",
      "description": "Open through the supported native graphical surface."
    },
    {
      "id": "STEP-03",
      "action": "accept_terms_and_options",
      "description": "Make explicit product options and consent choices."
    },
    {
      "id": "STEP-04",
      "action": "install",
      "description": "Install using the contracted platform authority."
    },
    {
      "id": "STEP-05",
      "action": "launch",
      "description": "Launch through the supported installed entrypoint."
    }
  ],
  "assertions": [
    {
      "id": "ASSERT-01",
      "type": "no_terminal_required",
      "description": "Complete the ordinary GUI journey without terminal input or manual ZIP extraction."
    },
    {
      "id": "ASSERT-02",
      "type": "no_unexpected_elevation",
      "description": "Per-user installation completes without administrator elevation."
    },
    {
      "id": "ASSERT-03",
      "type": "entrypoint_launches",
      "description": "Installed Start Menu/desktop entrypoint launches the installed desktop application."
    },
    {
      "id": "ASSERT-04",
      "type": "ipc_available",
      "description": "Desktop control uses the existing local, user-scoped IPC boundary."
    },
    {
      "id": "ASSERT-05",
      "type": "installation_ready",
      "description": "Report complete only after desktop and client executables, Qt runtime, platform integration and launch path are verified."
    },
    {
      "id": "ASSERT-06",
      "type": "file_exists",
      "description": "Client executable is present in the installed payload."
    },
    {
      "id": "ASSERT-07",
      "type": "file_exists",
      "description": "Required Qt runtime libraries and QML modules are present beside the installed product."
    },
    {
      "id": "ASSERT-08",
      "type": "file_exists",
      "description": "Installed application and client payload exist at the deterministic per-user product location."
    }
  ],
  "preservation_assertions": [],
  "forbidden_outcomes": [
    {
      "id": "FORBID_LIBRARY_DELETE",
      "description": "Installer lifecycle deletes user library content.",
      "on_observed": "FAIL"
    },
    {
      "id": "FORBID_SECRET_LEAK",
      "description": "Credential value is written to ordinary config or diagnostics.",
      "on_observed": "FAIL"
    },
    {
      "id": "FORBID_UNKNOWN_SCHEMA_RESET",
      "description": "Unknown or newer schema is reset or downgraded.",
      "on_observed": "FAIL"
    },
    {
      "id": "FORBID_SILENT_STARTUP",
      "description": "Persistent startup is enabled without explicit user consent.",
      "on_observed": "FAIL"
    },
    {
      "id": "FORBID_PUBLIC_CONTROL",
      "description": "Desktop control is exposed through a public TCP/HTTP listener.",
      "on_observed": "FAIL"
    },
    {
      "id": "FORBID_BLIND_REPLAY",
      "description": "An ambiguous mutation is blindly replayed without authoritative reconciliation.",
      "on_observed": "FAIL"
    },
    {
      "id": "FORBID_EARLY_SUCCESS",
      "description": "Installation is reported complete before payload, integration and launch verification.",
      "on_observed": "FAIL"
    },
    {
      "id": "FORBID_MANUAL_ZIP",
      "description": "Ordinary Windows journey requires manual ZIP extraction.",
      "on_observed": "FAIL"
    }
  ],
  "evidence_requirements": {
    "minimum": "native-clean-machine",
    "satisfies": [
      "native-clean-machine",
      "release-acceptance"
    ]
  },
  "timeout_policy": {
    "seconds": 1800,
    "on_unknown_outcome": "reconcile_before_retry"
  },
  "cleanup_policy": {
    "ownership_scope": "scenario_created_only",
    "best_effort": true,
    "record_failure": true
  },
  "future_owner": {
    "implementation": [
      "P022",
      "P023",
      "P024",
      "P025",
      "P026",
      "P027"
    ],
    "acceptance": [
      "P028"
    ]
  },
  "availability": "IMPLEMENTATION_PENDING",
  "source_installation": null,
  "milestones": [
    "INSTALLATION_READY",
    "APPLICATION_LAUNCHED"
  ],
  "interruption_points": [],
  "recovery_classifications": [],
  "capability_conditions": []
}
