{
  "schema_version": 1,
  "id": "INSTALL-JOURNEY-3",
  "title": "Fedora or qualified RPM graphical install and launch",
  "journey": "Native RPM database owns installation; authorization is visible; dependencies resolve; menu entry/icon and launch work; hooks do not enable persistent sync. Other RPM-family distributions are detected but not qualified.",
  "platform": {
    "family": "fedora",
    "qualified_versions": [
      "Fedora 42 x86_64 (P018 qualified; P020 native acceptance evidence pending)"
    ],
    "desktop_session": "required for graphical desktop journeys; otherwise not applicable",
    "package_manager": "dnf",
    "native_gui_package_handler": "plasma-discover",
    "applicable_families": [
      "fedora"
    ]
  },
  "architecture": "x86_64",
  "execution_class": "NATIVE_CLEAN_MACHINE",
  "preconditions": [
    "Disposable dedicated acceptance identity and scenario-owned state.",
    "No prior Synveil installation, package registration, installer-owned integration or stale acceptance state unless a declared upgrade/recovery source is required.",
    "A brand-new OS and removal of unrelated user files are not required."
  ],
  "required_capabilities": [
    "graphical_session",
    "native_package_manager",
    "administrator_elevation",
    "secret_store"
  ],
  "artifact_requirements": {
    "required": true,
    "artifact_type": "RPM",
    "identity_fields": [
      "product_version",
      "source_commit",
      "artifact_type",
      "filename",
      "sha256",
      "platform",
      "architecture",
      "release_channel",
      "trust_status"
    ]
  },
  "steps": [
    {
      "id": "STEP-01",
      "action": "obtain_artifact",
      "description": "Obtain and identify the required artifact."
    },
    {
      "id": "STEP-02",
      "action": "open_installer",
      "description": "Open through the supported native graphical surface."
    },
    {
      "id": "STEP-03",
      "action": "install",
      "description": "Install using the contracted platform authority."
    },
    {
      "id": "STEP-04",
      "action": "launch",
      "description": "Launch through the supported installed entrypoint."
    }
  ],
  "assertions": [
    {
      "id": "ASSERT-01",
      "type": "package_installed",
      "description": "Native RPM database owns the installed package."
    },
    {
      "id": "ASSERT-02",
      "type": "entrypoint_launches",
      "description": "Installed menu entry and icon launch Synveil as the signed-in user."
    },
    {
      "id": "ASSERT-03",
      "type": "no_terminal_required",
      "description": "Graphical package installation and launch require no terminal."
    },
    {
      "id": "ASSERT-04",
      "type": "installation_ready",
      "description": "Required package dependencies, payload, desktop entry and launch are verified before success."
    },
    {
      "id": "ASSERT-05",
      "type": "administrator_elevation_expected",
      "description": "Use the native package manager privilege prompt; do not hide or bypass package-manager authorization."
    }
  ],
  "preservation_assertions": [],
  "forbidden_outcomes": [
    {
      "id": "FORBID_LIBRARY_DELETE",
      "description": "Installer lifecycle deletes user library content.",
      "on_observed": "FAIL"
    },
    {
      "id": "FORBID_SECRET_LEAK",
      "description": "Credential value is written to ordinary config or diagnostics.",
      "on_observed": "FAIL"
    },
    {
      "id": "FORBID_UNKNOWN_SCHEMA_RESET",
      "description": "Unknown or newer schema is reset or downgraded.",
      "on_observed": "FAIL"
    },
    {
      "id": "FORBID_SILENT_STARTUP",
      "description": "Persistent startup is enabled without explicit user consent.",
      "on_observed": "FAIL"
    },
    {
      "id": "FORBID_PUBLIC_CONTROL",
      "description": "Desktop control is exposed through a public TCP/HTTP listener.",
      "on_observed": "FAIL"
    },
    {
      "id": "FORBID_BLIND_REPLAY",
      "description": "An ambiguous mutation is blindly replayed without authoritative reconciliation.",
      "on_observed": "FAIL"
    },
    {
      "id": "FORBID_EARLY_SUCCESS",
      "description": "Installation is reported complete before payload, integration and launch verification.",
      "on_observed": "FAIL"
    }
  ],
  "evidence_requirements": {
    "minimum": "native-clean-machine",
    "satisfies": [
      "native-clean-machine",
      "release-acceptance"
    ]
  },
  "timeout_policy": {
    "seconds": 1800,
    "on_unknown_outcome": "reconcile_before_retry"
  },
  "cleanup_policy": {
    "ownership_scope": "scenario_created_only",
    "best_effort": true,
    "record_failure": true
  },
  "future_owner": {
    "implementation": [
      "P012",
      "P014",
      "P019"
    ],
    "acceptance": [
      "P020"
    ]
  },
  "availability": "IMPLEMENTATION_PENDING",
  "source_installation": null,
  "milestones": [
    "INSTALLATION_READY",
    "APPLICATION_LAUNCHED"
  ],
  "interruption_points": [],
  "recovery_classifications": [],
  "capability_conditions": []
}
